{"artifact_id":"artifact-tag-rec-001","artifact_type":"tag.recommendation","schema_id":"artifact-envelope","schema_version":"1.0.0","created_at":"2026-07-25T00:30:00Z","producer_id":"reviewer-001","producer_type":"VALIDATOR","q_id":"Q-DEMO-001","repository_id":"GDS-DOCS","approval_id":null,"execution_id":"exec-001","attempt_id":"attempt-001","correlation_id":"corr-001","causation_id":"receipt-push-001","parent_artifact_id":null,"classification":"INTERNAL","content_type":"application/json","content_encoding":"utf-8","payload_digest":"sha256:5656565656565656565656565656565656565656565656565656565656565656","payload_size":42,"retention_class":"WORKFLOW_90D","redaction_state":"NONE","status":"VALIDATED","metadata":{"not_an_effect":true},"payload":{"recommended_tag":"v1.0.0"}}
